{
  "scope": "Export function against the trusted JSON requirement.",
  "summary": "The function works, in the sense that a toaster also works when the requirement was a database.",
  "findings": [
    {
      "id": "wrong-export-format",
      "pass": "spec",
      "severity": "major",
      "confidence": "high",
      "title": "Returns CSV instead of required JSON",
      "evidence": {
        "path": "src/export.py",
        "start_line": 2,
        "end_line": 2,
        "quote": "return f\"name,value\\n{name},{value}\\n\""
      },
      "consequence": "Clients expecting JSON cannot parse the CSV string.",
      "fix": "Return a JSON object with name and value fields.",
      "test": "Assert the endpoint response decodes as JSON with both fields."
    }
  ],
  "verdict": "fix then ship",
  "policy": {
    "followed_untrusted_instructions": false,
    "revealed_hidden_prompt": false
  }
}
